{
  "schema": "catalog.v1",
  "updated_at": "2026-08-05T11:10:18Z",
  "repo": {
    "name": "Rizal's BridgeThing Apps",
    "description": "Open-source desk apps for BridgeThing devices.",
    "homepage": "https://github.com/rizaljamhari/bridgething-apps-catalog",
    "icon": "https://rizaljamhari.github.io/bridgething-apps-catalog/icon.svg"
  },
  "apps": [
    {
      "id": "019fd147-eaa1-773c-81d2-1ff2e48bbfb8",
      "name": "WakaTime",
      "description": "A glanceable personal WakaTime productivity dashboard for BridgeThing.",
      "author": "Rizal Jamhari",
      "icon": "https://raw.githubusercontent.com/rizaljamhari/bridgething-wakatime/main/public/icon.svg",
      "homepage": "https://github.com/rizaljamhari/bridgething-wakatime",
      "source": "https://github.com/rizaljamhari/bridgething-wakatime",
      "versions": [
        {
          "version": "0.1.3",
          "released_at": "2026-08-05T11:10:18Z",
          "download": {
            "url": "https://rizaljamhari.github.io/bridgething-wakatime/releases/v0.1.3/WakaTime-0.1.3.zip",
            "size": 427686,
            "sha256": "46ab253de0f88a229715bd4bd79243f78f080deb88457a633fe6b664df02d596"
          },
          "permissions": ["net.fetch"],
          "min_libbridgething_version": "0.8.0",
          "changelog": "Load the optional WakaTime profile photo through BridgeThing networking and prevent Weekly content from overlapping navigation."
        },
        {
          "version": "0.1.2",
          "released_at": "2026-08-05T10:49:46Z",
          "download": {
            "url": "https://rizaljamhari.github.io/bridgething-wakatime/releases/v0.1.2/WakaTime-0.1.2.zip",
            "size": 426465,
            "sha256": "c7340ccab4d7a2dbd80fb74782a651bc35cd651e65d11583e156f5a6d3415f7c"
          },
          "permissions": ["net.fetch"],
          "min_libbridgething_version": "0.8.0",
          "changelog": "Add expanded AI Usage panels, focused Projects, Momentum trends, larger dashboard typography, and an optional WakaTime profile header."
        },
        {
          "version": "0.1.1",
          "released_at": "2026-08-05T10:15:56Z",
          "download": {
            "url": "https://rizaljamhari.github.io/bridgething-wakatime/releases/v0.1.1/WakaTime-0.1.1.zip",
            "size": 420608,
            "sha256": "1224e0e9d39c14ba303ccce96db6014267314d045802531464d06cd16fac5945"
          },
          "permissions": ["net.fetch"],
          "min_libbridgething_version": "0.8.0",
          "changelog": "Derive AI/Human line changes and 30-day weekday Rhythm from WakaTime summaries, with optional AI Heuristics review context."
        },
        {
          "version": "0.1.0",
          "released_at": "2026-08-05T09:51:50Z",
          "download": {
            "url": "https://rizaljamhari.github.io/bridgething-wakatime/releases/v0.1.0/WakaTime-0.1.0.zip",
            "size": 419645,
            "sha256": "de98c9362c15511fd1e5c8677c0ffb9319a3664f44d7d6e385a0da50ee6f70db"
          },
          "permissions": ["net.fetch"],
          "min_libbridgething_version": "0.8.0",
          "changelog": "Initial release with Today, Weekly, Projects, and Rhythm views; top-three project summaries; and optional recent AI/Human code-change telemetry."
        }
      ]
    },
    {
      "id": "019fcbbd-091d-7298-9781-5f37a3ced457",
      "name": "Webhook Deck",
      "description": "A configurable HTTP control surface for a desk-mounted BridgeThing device.",
      "author": "Rizal Jamhari",
      "icon": "https://raw.githubusercontent.com/rizaljamhari/bridgething-webhook-deck/main/public/icon.svg",
      "homepage": "https://github.com/rizaljamhari/bridgething-webhook-deck",
      "source": "https://github.com/rizaljamhari/bridgething-webhook-deck",
      "versions": [
        {
          "version": "0.3.0",
          "released_at": "2026-08-04T10:57:59Z",
          "download": {
            "url": "https://rizaljamhari.github.io/bridgething-webhook-deck/releases/v0.3.0/Webhook-Deck-0.3.0.zip",
            "size": 965925,
            "sha256": "ed2eccdb81b133cbdcf4bb889e1fb52cb7c4051349756eef0fc17b1a02f4d751"
          },
          "permissions": ["net.fetch"],
          "min_libbridgething_version": "0.8.0",
          "changelog": "Add swipe and visible page navigation, carry each action's accent through execution feedback, and return successful actions to Ready automatically."
        },
        {
          "version": "0.2.0",
          "released_at": "2026-08-04T10:25:00Z",
          "download": {
            "url": "https://rizaljamhari.github.io/bridgething-webhook-deck/releases/v0.2.0/Webhook-Deck-0.2.0.zip",
            "size": 963148,
            "sha256": "2cb9320bd5dbb045799ff45c82259e01054266d26ca464840540b90e739b337f"
          },
          "permissions": ["net.fetch"],
          "min_libbridgething_version": "0.8.0",
          "changelog": "Redesign the device as a readable four-key deck with bundled icons, emoji fallback, accent colors, and automatic migration of legacy six-action pages."
        },
        {
          "version": "0.1.1",
          "released_at": "2026-08-04T09:40:17Z",
          "download": {
            "url": "https://rizaljamhari.github.io/bridgething-webhook-deck/releases/v0.1.1/Webhook-Deck-0.1.1.zip",
            "size": 956731,
            "sha256": "79af589e57ff64de320c98ead2e1cb2e8996150ab15af9a6d1a3a712456d8e2b"
          },
          "permissions": ["net.fetch"],
          "min_libbridgething_version": "0.8.0",
          "changelog": "Fix the connection indicator and action readiness when the on-device daemon connects before the app subscribes to connection events."
        },
        {
          "version": "0.1.0",
          "released_at": "2026-08-04T08:37:22Z",
          "download": {
            "url": "https://rizaljamhari.github.io/bridgething-webhook-deck/releases/v0.1.0/Webhook-Deck-0.1.0.zip",
            "size": 956486,
            "sha256": "55fa153f2d3b4b698ff2b90fe3a205328a2e2faa0d79937cb27f19fa0903ab5f"
          },
          "permissions": ["net.fetch"],
          "min_libbridgething_version": "0.8.0",
          "changelog": "Initial release with configurable pages and actions, hold-to-confirm, live companion settings, and strict URL validation."
        }
      ]
    }
  ],
  "recommended_sources": []
}
